### ISSUE TITLE
flake: `allow-all/pod-to-world/http(s)-to-cilium-io` fails

### ISSUE THREAD

**Issue by gandro** [cilium/cilium-cli#367]
Observed in https://github.com/cilium/cilium-cli/pull/366 on EKS:

https://github.com/cilium/cilium-cli/pull/366/checks?check_run_id=2905226287

The flow logs indicate that a DNS request was made, but no TCP connection was ever established:

```
   [.] Action [allow-all/pod-to-world/http-to-www-google: cilium-test/client-7b7bf54b85-h6qvt (10.0.1.205) -> www-google-http (www.google.com:80)]
  ❌ command "curl -w %{local_ip}:%{local_port} -> %{remote_ip}:%{remote_port} = %{response_code} --silent --fail --show-error --connect-timeout 5 --output /dev/null http://www.google.com:80" failed: command terminated with exit code 28
  📄 Matching flows for pod cilium-test/client-7b7bf54b85-h6qvt
  ℹ️  SYN and(ip(src=10.0.1.205),tcp(dstPort=80),tcpflags(syn)) not found
  ℹ️  SYN and(ip(src=10.0.1.205),tcp(dstPort=80),tcpflags(syn)) not found
  ℹ️  SYN and(ip(src=10.0.1.205),tcp(dstPort=80),tcpflags(syn)) not found
  ℹ️  SYN and(ip(src=10.0.1.205),tcp(dstPort=80),tcpflags(syn)) not found
  ℹ️  SYN and(ip(src=10.0.1.205),tcp(dstPort=80),tcpflags(syn)) not found
  ℹ️  SYN and(ip(src=10.0.1.205),tcp(dstPort=80),tcpflags(syn)) not found
  ℹ️  SYN and(ip(src=10.0.1.205),tcp(dstPort=80),tcpflags(syn)) not found
  ℹ️  SYN and(ip(src=10.0.1.205),tcp(dstPort=80),tcpflags(syn)) not found
  ℹ️  SYN and(ip(src=10.0.1.205),tcp(dstPort=80),tcpflags(syn)) not found
  ℹ️  SYN and(ip(src=10.0.1.205),tcp(dstPort=80),tcpflags(syn)) not found
  ℹ️  SYN and(ip(src=10.0.1.205),tcp(dstPort=80),tcpflags(syn)) not found
  ⌛ Waiting (5s) for flows: Required flows not found yet
  ℹ️  SYN and(ip(src=10.0.1.205),tcp(dstPort=80),tcpflags(syn)) not found
  ℹ️  SYN and(ip(src=10.0.1.205),tcp(dstPort=80),tcpflags(syn)) not found
  ℹ️  SYN and(ip(src=10.0.1.205),tcp(dstPort=80),tcpflags(syn)) not found
  ℹ️  SYN and(ip(src=10.0.1.205),tcp(dstPort=80),tcpflags(syn)) not found
  ℹ️  SYN and(ip(src=10.0.1.205),tcp(dstPort=80),tcpflags(syn)) not found
  ℹ️  SYN and(ip(src=10.0.1.205),tcp(dstPort=80),tcpflags(syn)) not found
  ℹ️  SYN and(ip(src=10.0.1.205),tcp(dstPort=80),tcpflags(syn)) not found
  ℹ️  SYN and(ip(src=10.0.1.205),tcp(dstPort=80),tcpflags(syn)) not found
  ℹ️  SYN and(ip(src=10.0.1.205),tcp(dstPort=80),tcpflags(syn)) not found
  ✅ DNS request found at 0
  ✅ DNS response found at 3
  ❌ Flow validation failed for pod cilium-test/client-7b7bf54b85-h6qvt: 1 failures (first: 0, last: 3, matched: 2)
```

It's not clear why there was never any TCP outgoing connection from curl. Unfortunately we don't seem to collect any L7 flows which would give us more insight into what the DNS response was.

**Comment by tklauser** [comment]
Seen the same on GKE with #364: https://github.com/cilium/cilium-cli/pull/364/checks?check_run_id=2903745040

**Comment by tklauser** [comment]
#373 changed the connectivity tests to use `*.cilium.io` instead of `*.google.com`, but it seems like failures of this kind still occur, see e.g. https://github.com/cilium/cilium-cli/runs/2969863237.

**Comment by michi-covalent** [comment]
> #373 changed the connectivity tests to use `*.cilium.io` instead of `*.google.com`, but it seems like failures of this kind still occur, see e.g. https://github.com/cilium/cilium-cli/runs/2969863237.

this one is actually even worse, it looks like `curl` succeeded (no 28 error) but still no SYN packet 🤯

**Comment by michi-covalent** [comment]
still happening with cilium.io: https://github.com/cilium/cilium-cli/actions/runs/1102848558

**Comment by nbusseneau** [comment]
Following discussion in community meeting:
- Try switching to `one.one.one.one` first, then:
  - If it works, evaluate moving to a HA system (e.g. a DNS zone hosted at major provider)
  - If it does not work, then the external service is surely not the problem and we should look at CoreDNS:
    - DNS visibility annotation?
    - CoreDNS logs?
    - Alpine issue? https://stackoverflow.com/questions/65181012/does-alpine-have-known-dns-issue-within-kubernetes

**Comment by michi-covalent** [comment]
thanks @nbusseneau 

i opened a draft pr to bring back dns visibility annotation https://github.com/cilium/cilium-cli/pull/510 hoping to hit the flake and get some more information about what's failing 👀

**Comment by michi-covalent** [comment]
another thing we could try is to use non-alpine image 👀  cc @ldelossa 
```
defaults/defaults.go:   ConnectivityCheckAlpineCurlImage = "quay.io/cilium/alpine-curl:v1.4.0@sha256:2550c747831ff575f2147149b088ea981c06f9b6bcd188756d1b82cc10997956"
```

**Comment by ldelossa** [comment]
I went down the rabbit hole on this. 

I'm attching two pcaps which demonstrate the issue when curl hangs. 

The relevant summary from this pcaps follows:

Successful DNS requests utilize the `/etc/resolv.conf`resolver:
```
[root@client-57ddfcd474-zqmbl /]# cat /etc/resolv.conf 
search cilium-test.svc.cluster.local svc.cluster.local cluster.local c.cilium-dev.internal google.internal
nameserver 10.155.240.10
```

In the pcaps you'll see successful DNS request flows with `10.155.240.10` as src or destination. 

When curl begins to hang, you'll see that the return traffic for a DNS request to `10.155.240.10` is from source `10.152.0.119`. When the return packet with this source hits the network stack an ICMP port unreachanle message is returned to the source. 

This `10.152.0.199` ip address is the endpoint ip for kube-dns in my reproduction environment:
```
ENDPOINT   POLICY (ingress)   POLICY (egress)   IDENTITY   LABELS (source:key[=value])                              IPv6   IPv4           STATUS   
           ENFORCEMENT        ENFORCEMENT                                                                                                 
495        Disabled           Disabled          19920      k8s:io.cilium.k8s.policy.cluster=ldelossa-dev                   10.152.0.119   ready   
                                                           k8s:io.cilium.k8s.policy.serviceaccount=kube-dns                                       
                                                           k8s:io.kubernetes.pod.namespace=kube-system                                            
                                                           k8s:k8s-app=kube-dns   
```

As a bit of summary, what i think is going on here is:

* curl is issued inside the container
* dns request is sent to the resolver in /etc/resolv.conf (10.155.240.10)
* request goes thru the typical kube-proxy iptable rules and gets DNAT'd to kube-dns endpoint ip (10.152.0.199)
* intermittently, the un-DNAT from 10.152.0.199 -> 10.152.0.199 never occurs 
* the un-DNAT'd response hits the network stack and there's no socket associated with this erreronous network tuple 
* curl sits there and hangs until timeout since no return traffic gets back to it. 


I believe subsequent debugging should investigate why we are failing to un-DNAT in certain scenarios.

[dns-flake-pcaps.zip](https://github.com/cilium/cilium-cli/files/7100199/dns-flake-pcaps.zip)

**Comment by ldelossa** [comment]
I can now readily reproduce this. 

The CT map has a dynamic garbage collection interval. If you want long enough you'll see the CT map garbage collection get sufficiently large. 

```
2021-09-02T17:50:54.021808954Z level=info msg="Conntrack garbage collector interval recalculated" deleteRatio=0.007598876953125 newInterval=17m45s subsys=map-ct
```

Once this happens, you can begin spamming the container with the same curl commands which fail in the test

```
 while curl --silent --fail --show-error --connect-timeout 5 --output /dev/null http://jenkins.cilium.io:80; do echo "ok $(date)"; done
```

Doing this from a few shells will begin to pack the CT map with out going CT entries for the kube-dns service ip. 

Once the map gets sufficient large, it begins to delete recent entries in small batches, I do not believe this is GC doing this, maybe some other overflow mechanism? When it begins to delete these overflows curl will begin to fail. 

Finally a proper CT map GC occurs with a massive deleteRatio:
```
2021-09-02T18:08:39.622202292Z level=info msg="Conntrack garbage collector interval recalculated" deleteRatio=0.9 newInterval=1m46s subsys=map-ct
```

From here, the new GC interval kicks in, and the CT map is cleared out more efficiently, curl stops failing.

**Comment by ldelossa** [comment]
I was able to confirm this behavior even easier by setting the `ct` map size to 2048 in the cilium config map. 

Once we hit enough nat entries we see the demonstrated behavior. 

The outstanding question is whether we are evicting records erroroneously from the `ct` table or from the `nat` table. 

Once this is determined the immediate fix to to allocate more space to nat related bpf maps in CI. 

A long term fix is a bit more involved and revolves around the conn tracking GC algo. This will most likely be a new proposal.

**Comment by nbusseneau** [comment]
Oh look, it still happens with `one.one.one.one`! I think we might be having a different issue 🙃 
```
📋 Test Report
❌ 1/11 tests failed (1/110 actions), 0 tests skipped, 0 scenarios skipped:
Test [allow-all]:
  ❌ allow-all/pod-to-world/https-to-one-one-one-one-index-1: cilium-test/client2-65f446d77c-fhtmx (10.244.0.142) -> one-one-one-one-https-index (one.one.one.one:443)
```

**Comment by pchaigno** [comment]
KPR is disabled in those failing tests since we disable it by default for CLI installations, no? I don't understand why our BPF CT logic & map would impact the reverse DNAT performed by netfilter; those are two separate things. What am I missing?

**Comment by michi-covalent** [comment]
> Oh look, it still happens with `one.one.one.one`! I think we _might_ be having a different issue 🙃

yeah i don't think the issue is with the server, curl is failing to resolve dns names 😞 posting the link as a reference: https://github.com/cilium/cilium-cli/runs/3506288294?check_suite_focus=true#step:11:2480

**Comment by ldelossa** [comment]
> KPR is disabled in those failing tests since we disable it by default for CLI installations, no? I don't understand why our BPF CT logic & map would impact the reverse DNAT performed by netfilter; those are two separate things. What am I missing?

I was under the impression that, even with KPR disabled, bpf_lxc still performs pod <> service translation and places CT and Nat entries into the appropriate bpf maps. 

Pretty sure you can set ct/nat map sizes to some hard coded low value, fill then up, and then this flake issue will begin to show itself.

**Comment by pchaigno** [comment]
> I was under the impression that, even with KPR disabled, bpf_lxc still performs service <> pod translation and places CT and Nat entries into the appropriate bpf maps.

Ah right, only for ClusterIP services IIRC which is the case here :+1:

**Comment by brb** [comment]
> request goes thru the typical kube-proxy iptable rules and gets DNAT'd to kube-dns endpoint ip (10.152.0.199)

This should not happen, right?

> The outstanding question is whether we are evicting records erroroneously from the ct table or from the nat table.

The BPF NAT map should not be involved in this case (i.e., ClusterIP via bpf_lxc), only the BPF CT map.

**Comment by ldelossa** [comment]
> > request goes thru the typical kube-proxy iptable rules and gets DNAT'd to kube-dns endpoint ip (10.152.0.199)
> 
> This should not happen, right?
> 
> > The outstanding question is whether we are evicting records erroroneously from the ct table or from the nat table.
> 
> The BPF NAT map should not be involved in this case (i.e., ClusterIP via bpf_lxc), only the BPF CT map.

> This should not happen, right?

that's correct. but I didnt know this at the time. netfilter rules are never hit and I confirmed this (translation happens in bpf_lxc and hops over netfilter)

**Comment by ldelossa** [comment]
@joestringer @michi-covalent and I did some further debugging. 

When DNS fails we see the return all the way up to the pod. 

# client pod failed dns request (no additional tcpdump output)
```
02:26:16.247899 IP 10.152.0.136.49708 > 10.155.240.10.53: 18812+ A? jenkins.cilium.io.cluster.local. (49)
02:26:16.247962 IP 10.152.0.136.49708 > 10.155.240.10.53: 19065+ AAAA? jenkins.cilium.io.cluster.local. (49)
```

# kube-dns receit of traffic and response
```
02:26:16.248007 IP 10.152.0.136.49708 > 10.152.1.47.53: 18812+ A? jenkins.cilium.io.cluster.local. (49)
02:26:16.248068 IP 10.152.0.136.49708 > 10.152.1.47.53: 19065+ AAAA? jenkins.cilium.io.cluster.local. (49)
02:26:16.248414 IP 10.152.1.47.53 > 10.152.0.136.49708: 19065 NXDomain 0/1/0 (142)
02:26:16.248458 IP 10.152.1.47.53 > 10.152.0.136.49708: 18812 NXDomain 0/1/0 (142)
```

# eth0 (LAN interface) of k8s node hosting client pod
```
02:26:16.247950 IP 10.152.0.136.49708 > 10.152.1.47.53: 18812+ A? jenkins.cilium.io.cluster.local. (49)
02:26:16.247980 IP 10.152.0.136.49708 > 10.152.1.47.53: 19065+ AAAA? jenkins.cilium.io.cluster.local. (49)
02:26:16.248435 IP 10.152.1.47.53 > 10.152.0.136.49708: 19065 NXDomain 0/1/0 (142)
02:26:16.248480 IP 10.152.1.47.53 > 10.152.0.136.49708: 18812 NXDomain 0/1/0 (142)
```

The above tcp dump shows a proof that the dns traffic gets all the way back to the LAN interface of the k8s node hosting the client pod. However, the k8s node's network stack fails to deliver to the client pod's veth interface.

I've extracted the relevant bits from the `cilium monitor` logs and also show a successful DNS flow. 

<details>
  <summary>cilium monitor logs</summary>
===== Relevant IPs ===========================

Client-Pod: 10.152.0.136

Kube-DNS-Pod: 10.152.1.47

Kube-DNS-Service: 10.155.240.10

================== Successful trace src port 57085 ====
{"cpu":"CPU 03:","type":"debug","message":"Conntrack lookup 1/2: src=10.152.0.136:57085 dst=10.152.1.47:53"}
{"cpu":"CPU 03:","type":"debug","message":"Conntrack lookup 2/2: nexthdr=17 flags=1"}
{"cpu":"CPU 03:","type":"debug","message":"CT entry found lifetime=16883026, revnat=1"}
{"cpu":"CPU 03:","type":"debug","message":"CT verdict: Established, revnat=1"}
{"cpu":"CPU 03:","type":"debug","message":"Successfully mapped addr=10.152.1.47 to identity=17862"}
{"cpu":"CPU 03:","type":"trace","mark":"0x0","ifindex":"0","state":"established","observationPoint":"to-stack","traceSummary":"-\u003e stack","source":3206,"bytes":107,"srcLabel":8021,"dstLabel":17862,"dstID":0,"summary":{"ethernet":"Ethernet\t{Contents=[..14..] Payload=[..94..] SrcMAC=0a:37:5b:d1:18:cd DstMAC=36:83:a4:f2:28:0b EthernetType=IPv4 Length=0}","ipv4":"IPv4\t{Contents=[..20..] Payload=[..73..] Version=4 IHL=5 TOS=0 Length=93 Id=54189 Flags=DF FragOffset=0 TTL=64 Protocol=UDP Checksum=20476 SrcIP=10.152.0.136 DstIP=10.152.1.47 Options=[] Padding=[]}","udp":"UDP\t{Contents=[..8..] Payload=[..65..] SrcPort=57085 DstPort=53(domain) Length=73 Checksum=5953}","l2":{"src":"0a:37:5b:d1:18:cd","dst":"36:83:a4:f2:28:0b"},"l3":{"src":"10.152.0.136","dst":"10.152.1.47"},"l4":{"src":"57085","dst":"53"}}}
{"cpu":"CPU 03:","type":"capture","mark":"0x0","message":"Delivery to ifindex 0","prefix":"-\u003e 0","source":3206,"bytes":107,"summary":"10.152.0.136:57085 -\u003e 10.152.1.47:53 udp"}
{"cpu":"CPU 03:","type":"debug","message":"Conntrack lookup 1/2: src=10.152.0.136:57085 dst=10.155.240.10:53"}
{"cpu":"CPU 03:","type":"debug","message":"Conntrack lookup 2/2: nexthdr=17 flags=4"}
{"cpu":"CPU 03:","type":"debug","message":"CT entry found lifetime=16894893, revnat=1"}
{"cpu":"CPU 03:","type":"debug","message":"CT verdict: Reply, revnat=1"}
{"cpu":"CPU 03:","type":"debug","message":"Conntrack lookup 1/2: src=10.152.0.136:57085 dst=10.152.1.47:53"}
{"cpu":"CPU 03:","type":"debug","message":"Conntrack lookup 2/2: nexthdr=17 flags=1"}
{"cpu":"CPU 03:","type":"debug","message":"CT entry found lifetime=16894893, revnat=1"}
{"cpu":"CPU 03:","type":"debug","message":"CT verdict: Established, revnat=1"}
{"cpu":"CPU 03:","type":"debug","message":"Successfully mapped addr=10.152.1.47 to identity=17862"}
{"cpu":"CPU 03:","type":"trace","mark":"0x0","ifindex":"0","state":"established","observationPoint":"to-stack","traceSummary":"-\u003e stack","source":3206,"bytes":107,"srcLabel":8021,"dstLabel":17862,"dstID":0,"summary":{"ethernet":"Ethernet\t{Contents=[..14..] Payload=[..94..] SrcMAC=0a:37:5b:d1:18:cd DstMAC=36:83:a4:f2:28:0b EthernetType=IPv4 Length=0}","ipv4":"IPv4\t{Contents=[..20..] Payload=[..73..] Version=4 IHL=5 TOS=0 Length=93 Id=54190 Flags=DF FragOffset=0 TTL=64 Protocol=UDP Checksum=20475 SrcIP=10.152.0.136 DstIP=10.152.1.47 Options=[] Padding=[]}","udp":"UDP\t{Contents=[..8..] Payload=[..65..] SrcPort=57085 DstPort=53(domain) Length=73 Checksum=5953}","l2":{"src":"0a:37:5b:d1:18:cd","dst":"36:83:a4:f2:28:0b"},"l3":{"src":"10.152.0.136","dst":"10.152.1.47"},"l4":{"src":"57085","dst":"53"}}}
{"cpu":"CPU 03:","type":"capture","mark":"0x0","message":"Delivery to ifindex 0","prefix":"-\u003e 0","source":3206,"bytes":107,"summary":"10.152.0.136:57085 -\u003e 10.152.1.47:53 udp"}
{"cpu":"CPU 02:","type":"debug","message":"Inheriting identity=2 from stack"}
{"cpu":"CPU 02:","type":"debug","message":"Successfully mapped addr=10.152.1.47 to identity=17862"}
{"cpu":"CPU 02:","type":"debug","message":"Attempting local delivery for container id 3206 from seclabel 8021"}
{"cpu":"CPU 02:","type":"debug","message":"Conntrack lookup 1/2: src=10.152.1.47:53 dst=10.152.0.136:57085"}
{"cpu":"CPU 02:","type":"debug","message":"Conntrack lookup 2/2: nexthdr=17 flags=0"}
{"cpu":"CPU 02:","type":"debug","message":"CT entry found lifetime=16894893, revnat=1"}
{"cpu":"CPU 02:","type":"debug","message":"CT verdict: Reply, revnat=1"}
{"cpu":"CPU 02:","type":"debug","message":"Reverse NAT lookup, index=1"}
{"cpu":"CPU 02:","type":"debug","message":"Performing reverse NAT, address=10.155.240.10 port=53"}
{"cpu":"CPU 02:","type":"trace","mark":"0x0","ifindex":"0","state":"reply","observationPoint":"to-endpoint","traceSummary":"-\u003e endpoint 3206","source":3206,"bytes":200,"srcLabel":17862,"dstLabel":8021,"dstID":3206,"summary":{"ethernet":"Ethernet\t{Contents=[..14..] Payload=[..190..] SrcMAC=36:83:a4:f2:28:0b DstMAC=0a:37:5b:d1:18:cd EthernetType=IPv4 Length=0}","ipv4":"IPv4\t{Contents=[..20..] Payload=[..166..] Version=4 IHL=5 TOS=0 Length=186 Id=45009 Flags=DF FragOffset=0 TTL=62 Protocol=UDP Checksum=34460 SrcIP=10.155.240.10 DstIP=10.152.0.136 Options=[] Padding=[]}","udp":"UDP\t{Contents=[..8..] Payload=[..158..] SrcPort=53(domain) DstPort=57085 Length=166 Checksum=37171}","l2":{"src":"36:83:a4:f2:28:0b","dst":"0a:37:5b:d1:18:cd"},"l3":{"src":"10.155.240.10","dst":"10.152.0.136"},"l4":{"src":"53","dst":"57085"}}}
{"cpu":"CPU 02:","type":"debug","message":"Inheriting identity=2 from stack"}
{"cpu":"CPU 02:","type":"debug","message":"Successfully mapped addr=10.152.1.47 to identity=17862"}
{"cpu":"CPU 02:","type":"debug","message":"Attempting local delivery for container id 3206 from seclabel 8021"}

====================== Failure trace src port 49708 ======
{"cpu":"CPU 03:","type":"debug","message":"Conntrack lookup 1/2: src=10.152.0.136:49708 dst=10.155.240.10:53"}
{"cpu":"CPU 03:","type":"debug","message":"Conntrack lookup 2/2: nexthdr=17 flags=4"}
{"cpu":"CPU 03:","type":"debug","message":"CT entry found lifetime=16883024, revnat=1"}
{"cpu":"CPU 03:","type":"debug","message":"CT verdict: Reply, revnat=1"}
{"cpu":"CPU 03:","type":"debug","message":"Conntrack lookup 1/2: src=10.152.0.136:49708 dst=10.152.1.47:53"}
{"cpu":"CPU 03:","type":"debug","message":"Conntrack lookup 2/2: nexthdr=17 flags=1"}
{"cpu":"CPU 03:","type":"debug","message":"CT entry found lifetime=16883024, revnat=1"}
{"cpu":"CPU 03:","type":"debug","message":"CT verdict: Established, revnat=1"}
{"cpu":"CPU 03:","type":"debug","message":"Successfully mapped addr=10.152.1.47 to identity=17862"}
{"cpu":"CPU 03:","type":"trace","mark":"0x0","ifindex":"0","state":"established","observationPoint":"to-stack","traceSummary":"-\u003e stack","source":3206,"bytes":91,"srcLabel":8021,"dstLabel":17862,"dstID":0,"summary":{"ethernet":"Ethernet\t{Contents=[..14..] Payload=[..78..] SrcMAC=0a:37:5b:d1:18:cd DstMAC=36:83:a4:f2:28:0b EthernetType=IPv4 Length=0}","ipv4":"IPv4\t{Contents=[..20..] Payload=[..57..] Version=4 IHL=5 TOS=0 Length=77 Id=54193 Flags=DF FragOffset=0 TTL=64 Protocol=UDP Checksum=20488 SrcIP=10.152.0.136 DstIP=10.152.1.47 Options=[] Padding=[]}","udp":"UDP\t{Contents=[..8..] Payload=[..49..] SrcPort=49708 DstPort=53(domain) Length=57 Checksum=5937}","l2":{"src":"0a:37:5b:d1:18:cd","dst":"36:83:a4:f2:28:0b"},"l3":{"src":"10.152.0.136","dst":"10.152.1.47"},"l4":{"src":"49708","dst":"53"}}}
{"cpu":"CPU 03:","type":"capture","mark":"0x0","message":"Delivery to ifindex 0","prefix":"-\u003e 0","source":3206,"bytes":91,"summary":"10.152.0.136:49708 -\u003e 10.152.1.47:53 udp"}
{"cpu":"CPU 03:","type":"debug","message":"Conntrack lookup 1/2: src=10.152.0.136:49708 dst=10.155.240.10:53"}
{"cpu":"CPU 03:","type":"debug","message":"Conntrack lookup 2/2: nexthdr=17 flags=4"}
{"cpu":"CPU 03:","type":"debug","message":"CT entry found lifetime=16894893, revnat=1"}
{"cpu":"CPU 03:","type":"debug","message":"CT verdict: Reply, revnat=1"}
{"cpu":"CPU 03:","type":"debug","message":"Conntrack lookup 1/2: src=10.152.0.136:49708 dst=10.152.1.47:53"}
{"cpu":"CPU 03:","type":"debug","message":"Conntrack lookup 2/2: nexthdr=17 flags=1"}
{"cpu":"CPU 03:","type":"debug","message":"CT entry found lifetime=16894893, revnat=1"}
{"cpu":"CPU 03:","type":"debug","message":"CT verdict: Established, revnat=1"}
{"cpu":"CPU 03:","type":"debug","message":"Successfully mapped addr=10.152.1.47 to identity=17862"}
{"cpu":"CPU 03:","type":"trace","mark":"0x0","ifindex":"0","state":"established","observationPoint":"to-stack","traceSummary":"-\u003e stack","source":3206,"bytes":91,"srcLabel":8021,"dstLabel":17862,"dstID":0,"summary":{"ethernet":"Ethernet\t{Contents=[..14..] Payload=[..78..] SrcMAC=0a:37:5b:d1:18:cd DstMAC=36:83:a4:f2:28:0b EthernetType=IPv4 Length=0}","ipv4":"IPv4\t{Contents=[..20..] Payload=[..57..] Version=4 IHL=5 TOS=0 Length=77 Id=54194 Flags=DF FragOffset=0 TTL=64 Protocol=UDP Checksum=20487 SrcIP=10.152.0.136 DstIP=10.152.1.47 Options=[] Padding=[]}","udp":"UDP\t{Contents=[..8..] Payload=[..49..] SrcPort=49708 DstPort=53(domain) Length=57 Checksum=5937}","l2":{"src":"0a:37:5b:d1:18:cd","dst":"36:83:a4:f2:28:0b"},"l3":{"src":"10.152.0.136","dst":"10.152.1.47"},"l4":{"src":"49708","dst":"53"}}}
{"cpu":"CPU 03:","type":"capture","mark":"0x0","message":"Delivery to ifindex 0","prefix":"-\u003e 0","source":3206,"bytes":91,"summary":"10.152.0.136:49708 -\u003e 10.152.1.47:53 udp"}
{"cpu":"CPU 01:","type":"debug","message":"Inheriting identity=2 from stack"}
{"cpu":"CPU 01:","type":"debug","message":"Successfully mapped addr=10.152.1.47 to identity=17862"}
{"cpu":"CPU 01:","type":"debug","message":"Attempting local delivery for container id 3206 from seclabel 8021"}
{"cpu":"CPU 01:","type":"debug","message":"Conntrack lookup 1/2: src=10.152.1.47:53 dst=10.152.0.136:49708"}
{"cpu":"CPU 01:","type":"debug","message":"Conntrack lookup 2/2: nexthdr=17 flags=0"}
{"cpu":"CPU 01:","type":"debug","message":"CT entry found lifetime=16894893, revnat=1"}
{"cpu":"CPU 01:","type":"debug","message":"CT verdict: Reply, revnat=1"}
{"cpu":"CPU 01:","type":"trace","mark":"0x0","ifindex":"0","state":"new","observationPoint":"to-proxy","traceSummary":"-\u003e proxy","source":3206,"bytes":184,"srcLabel":17862,"dstLabel":8021,"dstID":0,"summary":{"ethernet":"Ethernet\t{Contents=[..14..] Payload=[..174..] SrcMAC=36:83:a4:f2:28:0b DstMAC=0a:37:5b:d1:18:cd EthernetType=IPv4 Length=0}","ipv4":"IPv4\t{Contents=[..20..] Payload=[..150..] Version=4 IHL=5 TOS=0 Length=170 Id=45013 Flags=DF FragOffset=0 TTL=62 Protocol=UDP Checksum=30087 SrcIP=10.152.1.47 DstIP=10.152.0.136 Options=[] Padding=[]}","udp":"UDP\t{Contents=[..8..] Payload=[..142..] SrcPort=53(domain) DstPort=49708 Length=150 Checksum=12762}","l2":{"src":"36:83:a4:f2:28:0b","dst":"0a:37:5b:d1:18:cd"},"l3":{"src":"10.152.1.47","dst":"10.152.0.136"},"l4":{"src":"53","dst":"49708"}}}
{"cpu":"CPU 01:","type":"debug","message":"CT entry found lifetime=0, revnat=0"}
{"cpu":"CPU 01:","type":"debug","message":"Inheriting identity=2 from stack"}
{"cpu":"CPU 01:","type":"debug","message":"Successfully mapped addr=10.152.1.47 to identity=17862"}
{"cpu":"CPU 01:","type":"debug","message":"Attempting local delivery for container id 3206 from seclabel 8021"}
{"cpu":"CPU 01:","type":"debug","message":"Conntrack lookup 1/2: src=10.152.1.47:53 dst=10.152.0.136:49708"}
{"cpu":"CPU 01:","type":"debug","message":"Conntrack lookup 2/2: nexthdr=17 flags=0"}
{"cpu":"CPU 01:","type":"debug","message":"CT entry found lifetime=16894893, revnat=1"}
{"cpu":"CPU 01:","type":"debug","message":"CT verdict: Reply, revnat=1"}
{"cpu":"CPU 01:","type":"trace","mark":"0x0","ifindex":"0","state":"new","observationPoint":"to-proxy","traceSummary":"-\u003e proxy","source":3206,"bytes":184,"srcLabel":17862,"dstLabel":8021,"dstID":0,"summary":{"ethernet":"Ethernet\t{Contents=[..14..] Payload=[..174..] SrcMAC=36:83:a4:f2:28:0b DstMAC=0a:37:5b:d1:18:cd EthernetType=IPv4 Length=0}","ipv4":"IPv4\t{Contents=[..20..] Payload=[..150..] Version=4 IHL=5 TOS=0 Length=170 Id=45014 Flags=DF FragOffset=0 TTL=62 Protocol=UDP Checksum=30086 SrcIP=10.152.1.47 DstIP=10.152.0.136 Options=[] Padding=[]}","udp":"UDP\t{Contents=[..8..] Payload=[..142..] SrcPort=53(domain) DstPort=49708 Length=150 Checksum=19927}","l2":{"src":"36:83:a4:f2:28:0b","dst":"0a:37:5b:d1:18:cd"},"l3":{"src":"10.152.1.47","dst":"10.152.0.136"},"l4":{"src":"53","dst":"49708"}}}
{"cpu":"CPU 01:","type":"debug","message":"CT entry found lifetime=0, revnat=0"}
{"cpu":"CPU 03:","type":"debug","message":"Conntrack lookup 1/2: src=10.152.0.136:49708 dst=10.155.240.10:53"}
{"cpu":"CPU 03:","type":"debug","message":"Conntrack lookup 2/2: nexthdr=17 flags=4"}
{"cpu":"CPU 03:","type":"debug","message":"CT entry found lifetime=16894893, revnat=1"}
{"cpu":"CPU 03:","type":"debug","message":"CT verdict: Reply, revnat=1"}
{"cpu":"CPU 03:","type":"debug","message":"Conntrack lookup 1/2: src=10.152.0.136:49708 dst=10.152.1.47:53"}
{"cpu":"CPU 03:","type":"debug","message":"Conntrack lookup 2/2: nexthdr=17 flags=1"}
{"cpu":"CPU 03:","type":"debug","message":"CT entry found lifetime=16894893, revnat=1"}
{"cpu":"CPU 03:","type":"debug","message":"CT verdict: Established, revnat=1"}
{"cpu":"CPU 03:","type":"debug","message":"Successfully mapped addr=10.152.1.47 to identity=17862"}
{"cpu":"CPU 03:","type":"trace","mark":"0x0","ifindex":"0","state":"established","observationPoint":"to-stack","traceSummary":"-\u003e stack","source":3206,"bytes":91,"srcLabel":8021,"dstLabel":17862,"dstID":0,"summary":{"ethernet":"Ethernet\t{Contents=[..14..] Payload=[..78..] SrcMAC=0a:37:5b:d1:18:cd DstMAC=36:83:a4:f2:28:0b EthernetType=IPv4 Length=0}","ipv4":"IPv4\t{Contents=[..20..] Payload=[..57..] Version=4 IHL=5 TOS=0 Length=77 Id=55653 Flags=DF FragOffset=0 TTL=64 Protocol=UDP Checksum=19028 SrcIP=10.152.0.136 DstIP=10.152.1.47 Options=[] Padding=[]}","udp":"UDP\t{Contents=[..8..] Payload=[..49..] SrcPort=49708 DstPort=53(domain) Length=57 Checksum=5937}","l2":{"src":"0a:37:5b:d1:18:cd","dst":"36:83:a4:f2:28:0b"},"l3":{"src":"10.152.0.136","dst":"10.152.1.47"},"l4":{"src":"49708","dst":"53"}}}
{"cpu":"CPU 03:","type":"capture","mark":"0x0","message":"Delivery to ifindex 0","prefix":"-\u003e 0","source":3206,"bytes":91,"summary":"10.152.0.136:49708 -\u003e 10.152.1.47:53 udp"}
{"cpu":"CPU 03:","type":"debug","message":"Conntrack lookup 1/2: src=10.152.0.136:49708 dst=10.155.240.10:53"}
{"cpu":"CPU 03:","type":"debug","message":"Conntrack lookup 2/2: nexthdr=17 flags=4"}
{"cpu":"CPU 03:","type":"debug","message":"CT entry found lifetime=16894903, revnat=1"}
{"cpu":"CPU 03:","type":"debug","message":"CT verdict: Reply, revnat=1"}
{"cpu":"CPU 03:","type":"debug","message":"Conntrack lookup 1/2: src=10.152.0.136:49708 dst=10.152.1.47:53"}
{"cpu":"CPU 03:","type":"debug","message":"Conntrack lookup 2/2: nexthdr=17 flags=1"}
{"cpu":"CPU 03:","type":"debug","message":"CT entry found lifetime=16894903, revnat=1"}
{"cpu":"CPU 03:","type":"debug","message":"CT verdict: Established, revnat=1"}
{"cpu":"CPU 03:","type":"debug","message":"Successfully mapped addr=10.152.1.47 to identity=17862"}
{"cpu":"CPU 03:","type":"trace","mark":"0x0","ifindex":"0","state":"established","observationPoint":"to-stack","traceSummary":"-\u003e stack","source":3206,"bytes":91,"srcLabel":8021,"dstLabel":17862,"dstID":0,"summary":{"ethernet":"Ethernet\t{Contents=[..14..] Payload=[..78..] SrcMAC=0a:37:5b:d1:18:cd DstMAC=36:83:a4:f2:28:0b EthernetType=IPv4 Length=0}","ipv4":"IPv4\t{Contents=[..20..] Payload=[..57..] Version=4 IHL=5 TOS=0 Length=77 Id=55654 Flags=DF FragOffset=0 TTL=64 Protocol=UDP Checksum=19027 SrcIP=10.152.0.136 DstIP=10.152.1.47 Options=[] Padding=[]}","udp":"UDP\t{Contents=[..8..] Payload=[..49..] SrcPort=49708 DstPort=53(domain) Length=57 Checksum=5937}","l2":{"src":"0a:37:5b:d1:18:cd","dst":"36:83:a4:f2:28:0b"},"l3":{"src":"10.152.0.136","dst":"10.152.1.47"},"l4":{"src":"49708","dst":"53"}}}
{"cpu":"CPU 03:","type":"capture","mark":"0x0","message":"Delivery to ifindex 0","prefix":"-\u003e 0","source":3206,"bytes":91,"summary":"10.152.0.136:49708 -\u003e 10.152.1.47:53 udp"}
{"cpu":"CPU 01:","type":"debug","message":"Inheriting identity=2 from stack"}
{"cpu":"CPU 01:","type":"debug","message":"Successfully mapped addr=10.152.1.47 to identity=17862"}
{"cpu":"CPU 01:","type":"debug","message":"Attempting local delivery for container id 3206 from seclabel 8021"}
{"cpu":"CPU 01:","type":"debug","message":"Conntrack lookup 1/2: src=10.152.1.47:53 dst=10.152.0.136:49708"}
{"cpu":"CPU 01:","type":"debug","message":"Conntrack lookup 2/2: nexthdr=17 flags=0"}
{"cpu":"CPU 01:","type":"debug","message":"CT entry found lifetime=16894903, revnat=1"}
{"cpu":"CPU 01:","type":"debug","message":"CT verdict: Reply, revnat=1"}
{"cpu":"CPU 01:","type":"trace","mark":"0x0","ifindex":"0","state":"new","observationPoint":"to-proxy","traceSummary":"-\u003e proxy","source":3206,"bytes":184,"srcLabel":17862,"dstLabel":8021,"dstID":0,"summary":{"ethernet":"Ethernet\t{Contents=[..14..] Payload=[..174..] SrcMAC=36:83:a4:f2:28:0b DstMAC=0a:37:5b:d1:18:cd EthernetType=IPv4 Length=0}","ipv4":"IPv4\t{Contents=[..20..] Payload=[..150..] Version=4 IHL=5 TOS=0 Length=170 Id=45682 Flags=DF FragOffset=0 TTL=62 Protocol=UDP Checksum=29418 SrcIP=10.152.1.47 DstIP=10.152.0.136 Options=[] Padding=[]}","udp":"UDP\t{Contents=[..8..] Payload=[..142..] SrcPort=53(domain) DstPort=49708 Length=150 Checksum=12762}","l2":{"src":"36:83:a4:f2:28:0b","dst":"0a:37:5b:d1:18:cd"},"l3":{"src":"10.152.1.47","dst":"10.152.0.136"},"l4":{"src":"53","dst":"49708"}}}
{"cpu":"CPU 01:","type":"debug","message":"CT entry found lifetime=0, revnat=0"}
{"cpu":"CPU 01:","type":"debug","message":"Inheriting identity=2 from stack"}
{"cpu":"CPU 01:","type":"debug","message":"Successfully mapped addr=10.152.1.47 to identity=17862"}
{"cpu":"CPU 01:","type":"debug","message":"Attempting local delivery for container id 3206 from seclabel 8021"}
{"cpu":"CPU 01:","type":"debug","message":"Conntrack lookup 1/2: src=10.152.1.47:53 dst=10.152.0.136:49708"}
{"cpu":"CPU 01:","type":"debug","message":"Conntrack lookup 2/2: nexthdr=17 flags=0"}
{"cpu":"CPU 01:","type":"debug","message":"CT entry found lifetime=16894903, revnat=1"}
{"cpu":"CPU 01:","type":"debug","message":"CT verdict: Reply, revnat=1"}
{"cpu":"CPU 01:","type":"trace","mark":"0x0","ifindex":"0","state":"new","observationPoint":"to-proxy","traceSummary":"-\u003e proxy","source":3206,"bytes":184,"srcLabel":17862,"dstLabel":8021,"dstID":0,"summary":{"ethernet":"Ethernet\t{Contents=[..14..] Payload=[..174..] SrcMAC=36:83:a4:f2:28:0b DstMAC=0a:37:5b:d1:18:cd EthernetType=IPv4 Length=0}","ipv4":"IPv4\t{Contents=[..20..] Payload=[..150..] Version=4 IHL=5 TOS=0 Length=170 Id=45683 Flags=DF FragOffset=0 TTL=62 Protocol=UDP Checksum=29417 SrcIP=10.152.1.47 DstIP=10.152.0.136 Options=[] Padding=[]}","udp":"UDP\t{Contents=[..8..] Payload=[..142..] SrcPort=53(domain) DstPort=49708 Length=150 Checksum=19927}","l2":{"src":"36:83:a4:f2:28:0b","dst":"0a:37:5b:d1:18:cd"},"l3":{"src":"10.152.1.47","dst":"10.152.0.136"},"l4":{"src":"53","dst":"49708"}}}

</details>

**Comment by pchaigno** [comment]
I looked a bit into this. I used a recent failure to investigate: https://github.com/cilium/cilium-cli/runs/3583946569?check_suite_focus=true.

That test fails, ending with the below packet trace:
```
07:29:35.788: kube-system/coredns-5c778788f4-shlhm:53 -> cilium-test/client2-65f446d77c-ndqwj:33400 from-endpoint FORWARDED (UDP)
07:29:35.788: kube-system/coredns-5c778788f4-shlhm:53 -> cilium-test/client2-65f446d77c-ndqwj:33400 to-stack FORWARDED (UDP)
07:29:35.789: kube-system/coredns-5c778788f4-shlhm:53 -> cilium-test/client2-65f446d77c-ndqwj:33400 from-endpoint FORWARDED (UDP)
07:29:35.789: kube-system/coredns-5c778788f4-shlhm:53 -> cilium-test/client2-65f446d77c-ndqwj:33400 to-stack FORWARDED (UDP)
07:29:35.789: kube-system/coredns-5c778788f4-shlhm:53 -> cilium-test/client2-65f446d77c-ndqwj:33400 from-stack FORWARDED (UDP)
07:29:35.789: kube-system/coredns-5c778788f4-shlhm:53 -> cilium-test/client2-65f446d77c-ndqwj:33400 to-proxy FORWARDED (UDP)
07:29:35.789: kube-system/coredns-5c778788f4-shlhm:53 -> cilium-test/client2-65f446d77c-ndqwj:33400 from-stack FORWARDED (UDP)
07:29:35.789: kube-system/coredns-5c778788f4-shlhm:53 -> cilium-test/client2-65f446d77c-ndqwj:33400 to-proxy FORWARDED (UDP)
```
Notice the unexpected `to-proxy` trace (noticed by Louis before).

The dumps of `cilium bpf policy get --all` in both bugtools do not show any rule with proxy redirects. So the datapath should have no reason to redirect to proxy. However, looking at the CT map for that connection, on the node with the to-proxy trace (destination node), we can see:
```
$ git grep 192.168.146.17 cilium-bugtool-cilium-m4bxr-20210913-073249/cmd/cilium-bpf-ct-list-global.md | grep 33400
cilium-bugtool-cilium-m4bxr-20210913-073249/cmd/cilium-bpf-ct-list-global.md:UDP OUT 10.100.0.10:53 -> 192.168.146.17:33400 service expires=584 RxPackets=0 RxBytes=3 RxFlagsSeen=0x00 LastRxReport=0 TxPackets=0 TxBytes=0 TxFlagsSeen=0x00 LastTxReport=521 Flags=0x0000 [ ] RevNAT=2 SourceSecurityID=0 IfIndex=0 
cilium-bugtool-cilium-m4bxr-20210913-073249/cmd/cilium-bpf-ct-list-global.md:UDP OUT 192.168.146.17:33400 -> 192.168.109.141:53 expires=584 RxPackets=6 RxBytes=1100 RxFlagsSeen=0x00 LastRxReport=521 TxPackets=6 TxBytes=542 TxFlagsSeen=0x00 LastTxReport=521 Flags=0x0040 [ ProxyRedirect ] RevNAT=2 SourceSecurityID=531 IfIndex=0
```
Notice the `[ ProxyRedirect ]` in the second line.

The only way in the datapath to set that CT map bit is through the last argument of `ct_create4`. For example: https://github.com/cilium/cilium/blob/9e2d2173b715849aac0d6f810f3c46fb7c95ec28/bpf/bpf_lxc.c#L681-L682:
```c
ret = ct_create4(get_ct_map4(&tuple), &CT_MAP_ANY4, &tuple, ctx,
		 CT_EGRESS, &ct_state_new, verdict > 0);
```
Variable `verdict` is the return value of the policy enforcement functions, `policy_can_access_ingress` and `policy_can_egress4`.

We can get logs via `cilium monitor` for when this `verdict` is initially returned, at least via `policy-verdict`. The above debug logs don't seem to go back enough to show this however.

**Comment by ldelossa** [comment]
@pchaigno 

Looking over my logs. 

# test failure
```

📋 Test Report
❌ 1/1 tests failed (2/28 actions), 10 tests skipped, 0 scenarios skipped:
Test [allow-all]:
  ❌ allow-all/pod-to-world/http-to-cilium-io-0: cilium-test/client-7b7bf54b85-2c2h8 (10.152.2.203) -> cilium-io-http (cilium.io:80)
  ❌ allow-all/pod-to-world/http-to-jenkins-cilium-1: cilium-test/client-7b7bf54b85-2c2h8 (10.152.2.203) -> jenkins-cilium-io-http (jenkins.cilium.io:80)
Connectivity test failed: 1 tests failed
```

# client dns failure (no return traffic)
```
22:59:32.051718 IP client-7b7bf54b85-2c2h8.52344 > kube-dns.kube-system.svc.cluster.local.53: 61095+ A? jenkins.cilium.io.cluster.local. (49)
22:59:32.051772 IP client-7b7bf54b85-2c2h8.52344 > kube-dns.kube-system.svc.cluster.local.53: 61550+ AAAA? jenkins.cilium.io.cluster.local. (49)
22:59:34.552366 IP client-7b7bf54b85-2c2h8.52344 > kube-dns.kube-system.svc.cluster.local.53: 61095+ A? jenkins.cilium.io.cluster.local. (49)
22:59:34.552454 IP client-7b7bf54b85-2c2h8.52344 > kube-dns.kube-system.svc.cluster.local.53: 61550+ AAAA? jenkins.cilium.io.cluster.local. (49)
```

# monitor logs
```
root@gke-ldelossa-dev-default-pool-df165984-7s30:/home/cilium# cilium monitor -t policy-verdict --related-to=3485 --related-to=1349
Listening for events on 4 CPUs with 64x4096 of shared memory
Press Ctrl-C to quit
level=info msg="Initializing dissection cache..." subsys=monitor
Policy verdict log: flow 0x0 local EP ID 3485, remote ID 7670, proto 1, egress, action allow, match all, 10.152.2.203 -> 10.152.2.21 EchoRequest
Policy verdict log: flow 0x0 local EP ID 3485, remote ID 7670, proto 1, ingress, action allow, match all, 10.152.2.21 -> 10.152.2.203 EchoRequest
Policy verdict log: flow 0x0 local EP ID 3485, remote ID 61496, proto 17, egress, action allow, match all, 10.152.2.203:35962 -> 10.152.0.126:53 udp
Policy verdict log: flow 0xb1c6e3cb local EP ID 3485, remote ID 29119, proto 6, egress, action allow, match all, 10.152.2.203:33094 -> 10.152.0.250:8080 tcp SYN
Policy verdict log: flow 0x0 local EP ID 3485, remote ID 61496, proto 17, egress, action allow, match all, 10.152.2.203:57894 -> 10.152.0.126:53 udp
Policy verdict log: flow 0x4c8ca4ac local EP ID 3485, remote ID 6803, proto 6, egress, action allow, match all, 10.152.2.203:46180 -> 10.152.2.81:8080 tcp SYN
Policy verdict log: flow 0x39b65f1e local EP ID 3485, remote ID remote-node, proto 6, egress, action allow, match all, 10.152.2.203:42652 -> 10.150.16.9:32684 tcp SYN
Policy verdict log: flow 0x7347faef local EP ID 3485, remote ID remote-node, proto 6, egress, action allow, match all, 10.152.2.203:60526 -> 10.150.16.9:31440 tcp SYN
Policy verdict log: flow 0x381ee3c0 local EP ID 3485, remote ID host, proto 6, egress, action allow, match all, 10.152.2.203:56362 -> 10.150.16.5:32684 tcp SYN
Policy verdict log: flow 0xbadacaa3 local EP ID 3485, remote ID host, proto 6, egress, action allow, match all, 10.152.2.203:57636 -> 10.150.16.5:31440 tcp SYN
Policy verdict log: flow 0x0 local EP ID 3485, remote ID 61496, proto 17, egress, action allow, match all, 10.152.2.203:49739 -> 10.152.0.126:53 udp
Policy verdict log: flow 0x0 local EP ID 3485, remote ID 61496, proto 17, egress, action allow, match all, 10.152.2.203:57358 -> 10.152.0.126:53 udp
Policy verdict log: flow 0x0 local EP ID 3485, remote ID 61496, proto 17, egress, action allow, match all, 10.152.2.203:37014 -> 10.152.0.126:53 udp
Policy verdict log: flow 0x0 local EP ID 3485, remote ID 61496, proto 17, egress, action allow, match all, 10.152.2.203:33956 -> 10.152.0.126:53 udp
Policy verdict log: flow 0x0 local EP ID 3485, remote ID 61496, proto 17, egress, action allow, match all, 10.152.2.203:59559 -> 10.152.0.126:53 udp
Policy verdict log: flow 0x0 local EP ID 3485, remote ID 61496, proto 17, egress, action allow, match all, 10.152.2.203:57109 -> 10.152.0.126:53 udp
Policy verdict log: flow 0x717aa8f5 local EP ID 3485, remote ID 16777217, proto 6, egress, action allow, match all, 10.152.2.203:43462 -> 104.198.14.52:443 tcp SYN
Policy verdict log: flow 0x0 local EP ID 3485, remote ID 61496, proto 17, egress, action allow, match all, 10.152.2.203:58282 -> 10.152.0.126:53 udp
Policy verdict log: flow 0x0 local EP ID 3485, remote ID 61496, proto 17, egress, action allow, match all, 10.152.2.203:37770 -> 10.152.0.126:53 udp
Policy verdict log: flow 0x0 local EP ID 3485, remote ID 61496, proto 17, egress, action allow, match all, 10.152.2.203:41126 -> 10.152.0.126:53 udp
Policy verdict log: flow 0x0 local EP ID 3485, remote ID 61496, proto 17, egress, action allow, match all, 10.152.2.203:46442 -> 10.152.0.126:53 udp
Policy verdict log: flow 0x0 local EP ID 3485, remote ID 61496, proto 17, egress, action allow, match all, 10.152.2.203:41095 -> 10.152.0.126:53 udp
Policy verdict log: flow 0xa6150706 local EP ID 3485, remote ID 16777217, proto 6, egress, action allow, match all, 10.152.2.203:59640 -> 104.198.14.52:80 tcp SYN
Policy verdict log: flow 0x0 local EP ID 3485, remote ID 61496, proto 17, egress, action allow, match all, 10.152.2.203:45866 -> 10.152.0.126:53 udp
Policy verdict log: flow 0x0 local EP ID 3485, remote ID 61496, proto 17, egress, action allow, match all, 10.152.2.203:56186 -> 10.152.0.126:53 udp
Policy verdict log: flow 0x0 local EP ID 3485, remote ID 61496, proto 17, egress, action allow, match all, 10.152.2.203:56786 -> 10.152.0.126:53 udp
Policy verdict log: flow 0x0 local EP ID 3485, remote ID 61496, proto 17, egress, action allow, match all, 10.152.2.203:56107 -> 10.152.0.126:53 udp
Policy verdict log: flow 0x0 local EP ID 3485, remote ID 61496, proto 17, egress, action allow, match all, 10.152.2.203:53233 -> 10.152.0.126:53 udp
Policy verdict log: flow 0x0 local EP ID 3485, remote ID 61496, proto 17, egress, action allow, match all, 10.152.2.203:49011 -> 10.152.0.126:53 udp
Policy verdict log: flow 0xf3d83770 local EP ID 3485, remote ID world, proto 6, egress, action allow, match all, 10.152.2.203:52916 -> 54.148.123.155:80 tcp SYN
Policy verdict log: flow 0x0 local EP ID 3485, remote ID host, proto 1, egress, action allow, match all, 10.152.2.203 -> 10.150.16.5 EchoRequest
Policy verdict log: flow 0x0 local EP ID 3485, remote ID remote-node, proto 1, egress, action allow, match all, 10.152.2.203 -> 10.150.16.9 EchoRequest
Policy verdict log: flow 0x7c3a0cb0 local EP ID 3485, remote ID 29119, proto 6, egress, action allow, match all, 10.152.2.203:43914 -> 10.152.0.250:8080 tcp SYN
Policy verdict log: flow 0x959fc8f2 local EP ID 3485, remote ID 6803, proto 6, egress, action allow, match all, 10.152.2.203:41582 -> 10.152.2.81:8080 tcp SYN
Policy verdict log: flow 0x0 local EP ID 3485, remote ID 7670, proto 1, egress, action allow, match all, 10.152.2.203 -> 10.152.2.21 EchoRequest
Policy verdict log: flow 0x0 local EP ID 3485, remote ID 7670, proto 1, ingress, action allow, match all, 10.152.2.21 -> 10.152.2.203 EchoRequest
Policy verdict log: flow 0x0 local EP ID 3485, remote ID 61496, proto 17, egress, action allow, match all, 10.152.2.203:43856 -> 10.152.0.126:53 udp
Policy verdict log: flow 0xf1445f62 local EP ID 3485, remote ID 29119, proto 6, egress, action allow, match all, 10.152.2.203:33316 -> 10.152.0.250:8080 tcp SYN
Policy verdict log: flow 0x0 local EP ID 3485, remote ID 61496, proto 17, egress, action allow, match all, 10.152.2.203:42806 -> 10.152.0.126:53 udp
Policy verdict log: flow 0x7841f4db local EP ID 3485, remote ID 6803, proto 6, egress, action allow, match all, 10.152.2.203:46402 -> 10.152.2.81:8080 tcp SYN
Policy verdict log: flow 0xfe0de153 local EP ID 3485, remote ID remote-node, proto 6, egress, action allow, match all, 10.152.2.203:42870 -> 10.150.16.9:32684 tcp SYN
Policy verdict log: flow 0x8853c7d6 local EP ID 3485, remote ID remote-node, proto 6, egress, action allow, match all, 10.152.2.203:60744 -> 10.150.16.9:31440 tcp SYN
Policy verdict log: flow 0x3f6022d7 local EP ID 3485, remote ID host, proto 6, egress, action allow, match all, 10.152.2.203:56578 -> 10.150.16.5:32684 tcp SYN
Policy verdict log: flow 0x1a5b7cd7 local EP ID 3485, remote ID host, proto 6, egress, action allow, match all, 10.152.2.203:57852 -> 10.150.16.5:31440 tcp SYN
Policy verdict log: flow 0x0 local EP ID 3485, remote ID 61496, proto 17, egress, action allow, match all, 10.152.2.203:52136 -> 10.152.0.126:53 udp
Policy verdict log: flow 0x0 local EP ID 3485, remote ID 61496, proto 17, egress, action allow, match all, 10.152.2.203:35142 -> 10.152.0.126:53 udp
Policy verdict log: flow 0x0 local EP ID 3485, remote ID 61496, proto 17, egress, action allow, match all, 10.152.2.203:42315 -> 10.152.0.126:53 udp
Policy verdict log: flow 0x0 local EP ID 3485, remote ID 61496, proto 17, egress, action allow, match all, 10.152.2.203:35223 -> 10.152.0.126:53 udp
Policy verdict log: flow 0x0 local EP ID 3485, remote ID 61496, proto 17, egress, action allow, match all, 10.152.2.203:43372 -> 10.152.0.126:53 udp
Policy verdict log: flow 0x0 local EP ID 3485, remote ID 61496, proto 17, egress, action allow, match all, 10.152.2.203:59191 -> 10.152.0.126:53 udp
Policy verdict log: flow 0x9331b873 local EP ID 3485, remote ID 16777217, proto 6, egress, action allow, match all, 10.152.2.203:43674 -> 104.198.14.52:443 tcp SYN
Policy verdict log: flow 0x0 local EP ID 3485, remote ID 61496, proto 17, egress, action allow, match all, 10.152.2.203:43156 -> 10.152.0.126:53 udp
Policy verdict log: flow 0x0 local EP ID 3485, remote ID 61496, proto 17, egress, action allow, match all, 10.152.2.203:46746 -> 10.152.0.126:53 udp
Policy verdict log: flow 0x0 local EP ID 3485, remote ID 61496, proto 17, egress, action allow, match all, 10.152.2.203:58903 -> 10.152.0.126:53 udp
Policy verdict log: flow 0x0 local EP ID 3485, remote ID 61496, proto 17, egress, action allow, match all, 10.152.2.203:46564 -> 10.152.0.126:53 udp
Policy verdict log: flow 0x0 local EP ID 3485, remote ID 61496, proto 17, egress, action allow, match all, 10.152.2.203:41477 -> 10.152.0.126:53 udp
Policy verdict log: flow 0x0 local EP ID 3485, remote ID 61496, proto 17, egress, action allow, match all, 10.152.2.203:47746 -> 10.152.0.126:53 udp
Policy verdict log: flow 0x78ac142b local EP ID 3485, remote ID 16777217, proto 6, egress, action allow, match all, 10.152.2.203:59856 -> 104.198.14.52:80 tcp SYN
Policy verdict log: flow 0x0 local EP ID 3485, remote ID 61496, proto 17, egress, action allow, match all, 10.152.2.203:55465 -> 10.152.0.126:53 udp
Policy verdict log: flow 0x0 local EP ID 3485, remote ID 61496, proto 17, egress, action allow, match all, 10.152.2.203:50244 -> 10.152.0.126:53 udp
Policy verdict log: flow 0x0 local EP ID 3485, remote ID 61496, proto 17, egress, action allow, match all, 10.152.2.203:38412 -> 10.152.0.126:53 udp
Policy verdict log: flow 0x0 local EP ID 3485, remote ID 61496, proto 17, egress, action allow, match all, 10.152.2.203:45709 -> 10.152.0.126:53 udp
Policy verdict log: flow 0x0 local EP ID 3485, remote ID 61496, proto 17, egress, action allow, match all, 10.152.2.203:45172 -> 10.152.0.126:53 udp
Policy verdict log: flow 0x0 local EP ID 3485, remote ID 61496, proto 17, egress, action allow, match all, 10.152.2.203:55777 -> 10.152.0.126:53 udp
Policy verdict log: flow 0xc94a9615 local EP ID 3485, remote ID world, proto 6, egress, action allow, match all, 10.152.2.203:53136 -> 54.148.123.155:80 tcp SYN
Policy verdict log: flow 0x0 local EP ID 3485, remote ID host, proto 1, egress, action allow, match all, 10.152.2.203 -> 10.150.16.5 EchoRequest
Policy verdict log: flow 0x0 local EP ID 3485, remote ID remote-node, proto 1, egress, action allow, match all, 10.152.2.203 -> 10.150.16.9 EchoRequest
Policy verdict log: flow 0xa8565c5a local EP ID 3485, remote ID 29119, proto 6, egress, action allow, match all, 10.152.2.203:44142 -> 10.152.0.250:8080 tcp SYN
Policy verdict log: flow 0xfdfb543 local EP ID 3485, remote ID 6803, proto 6, egress, action allow, match all, 10.152.2.203:41808 -> 10.152.2.81:8080 tcp SYN
Policy verdict log: flow 0xa0834ede local EP ID 3485, remote ID 29119, proto 6, egress, action allow, match all, 10.152.2.203:44246 -> 10.152.0.250:8080 tcp SYN
Policy verdict log: flow 0x9b1bdec5 local EP ID 3485, remote ID 6803, proto 6, egress, action allow, match all, 10.152.2.203:41910 -> 10.152.2.81:8080 tcp SYN
Policy verdict log: flow 0x0 local EP ID 3485, remote ID 7670, proto 1, egress, action allow, match all, 10.152.2.203 -> 10.152.2.21 EchoRequest
Policy verdict log: flow 0x0 local EP ID 3485, remote ID 7670, proto 1, ingress, action allow, match all, 10.152.2.21 -> 10.152.2.203 EchoRequest
Policy verdict log: flow 0x0 local EP ID 3485, remote ID 61496, proto 17, egress, action allow, match all, 10.152.2.203:41142 -> 10.152.0.126:53 udp
Policy verdict log: flow 0xf7ee492f local EP ID 3485, remote ID 29119, proto 6, egress, action allow, match all, 10.152.2.203:33574 -> 10.152.0.250:8080 tcp SYN
Policy verdict log: flow 0x0 local EP ID 3485, remote ID 61496, proto 17, egress, action allow, match all, 10.152.2.203:45468 -> 10.152.0.126:53 udp
Policy verdict log: flow 0x6fd96b93 local EP ID 3485, remote ID 6803, proto 6, egress, action allow, match all, 10.152.2.203:46660 -> 10.152.2.81:8080 tcp SYN
Policy verdict log: flow 0x94bdfbcd local EP ID 3485, remote ID remote-node, proto 6, egress, action allow, match all, 10.152.2.203:43130 -> 10.150.16.9:32684 tcp SYN
Policy verdict log: flow 0x5660a600 local EP ID 3485, remote ID remote-node, proto 6, egress, action allow, match all, 10.152.2.203:32774 -> 10.150.16.9:31440 tcp SYN
Policy verdict log: flow 0x9c9c29e2 local EP ID 3485, remote ID host, proto 6, egress, action allow, match all, 10.152.2.203:56846 -> 10.150.16.5:32684 tcp SYN
Policy verdict log: flow 0x23e9e710 local EP ID 3485, remote ID host, proto 6, egress, action allow, match all, 10.152.2.203:58122 -> 10.150.16.5:31440 tcp SYN
Policy verdict log: flow 0x0 local EP ID 3485, remote ID 61496, proto 17, egress, action allow, match all, 10.152.2.203:60335 -> 10.152.0.126:53 udp
Policy verdict log: flow 0x0 local EP ID 3485, remote ID 61496, proto 17, egress, action allow, match all, 10.152.2.203:51327 -> 10.152.0.126:53 udp
Policy verdict log: flow 0x0 local EP ID 3485, remote ID 61496, proto 17, egress, action allow, match all, 10.152.2.203:36032 -> 10.152.0.126:53 udp
Policy verdict log: flow 0x0 local EP ID 3485, remote ID 61496, proto 17, egress, action allow, match all, 10.152.2.203:53073 -> 10.152.0.126:53 udp
Policy verdict log: flow 0x0 local EP ID 3485, remote ID 61496, proto 17, egress, action allow, match all, 10.152.2.203:48573 -> 10.152.0.126:53 udp
Policy verdict log: flow 0x0 local EP ID 3485, remote ID 61496, proto 17, egress, action allow, match all, 10.152.2.203:50218 -> 10.152.0.126:53 udp
Policy verdict log: flow 0x1c1fa610 local EP ID 3485, remote ID 16777217, proto 6, egress, action allow, match all, 10.152.2.203:43972 -> 104.198.14.52:443 tcp SYN
Policy verdict log: flow 0x0 local EP ID 3485, remote ID 61496, proto 17, egress, action allow, match all, 10.152.2.203:52905 -> 10.152.0.126:53 udp
Policy verdict log: flow 0x0 local EP ID 3485, remote ID 61496, proto 17, egress, action allow, match all, 10.152.2.203:38066 -> 10.152.0.126:53 udp
Policy verdict log: flow 0x0 local EP ID 3485, remote ID 61496, proto 17, egress, action allow, match all, 10.152.2.203:42071 -> 10.152.0.126:53 udp
Policy verdict log: flow 0x0 local EP ID 3485, remote ID 61496, proto 17, egress, action allow, match all, 10.152.2.203:45094 -> 10.152.0.126:53 udp
Policy verdict log: flow 0x0 local EP ID 3485, remote ID 61496, proto 17, egress, action allow, match all, 10.152.2.203:38699 -> 10.152.0.126:53 udp
Policy verdict log: flow 0x0 local EP ID 3485, remote ID 61496, proto 17, egress, action allow, match all, 10.152.2.203:45249 -> 10.152.0.126:53 udp
Policy verdict log: flow 0xae63357c local EP ID 3485, remote ID 16777217, proto 6, egress, action allow, match all, 10.152.2.203:60150 -> 104.198.14.52:80 tcp SYN
Policy verdict log: flow 0x0 local EP ID 3485, remote ID 61496, proto 17, egress, action allow, match all, 10.152.2.203:40040 -> 10.152.0.126:53 udp
Policy verdict log: flow 0x0 local EP ID 3485, remote ID 61496, proto 17, egress, action allow, match all, 10.152.2.203:58101 -> 10.152.0.126:53 udp
Policy verdict log: flow 0x0 local EP ID 3485, remote ID host, proto 1, egress, action allow, match all, 10.152.2.203 -> 10.150.16.5 EchoRequest
Policy verdict log: flow 0x0 local EP ID 3485, remote ID remote-node, proto 1, egress, action allow, match all, 10.152.2.203 -> 10.150.16.9 EchoRequest
```

I see no mention of any redirect policy being applied to the failing outbound traffic identifiable by source port 52344

**Comment by pchaigno** [comment]
> I see no mention of any redirect policy being applied to the failing outbound traffic identifiable by source port 52344

I see no mention of *any* policy-verdict for 10.152.2.203:52344, so it probably happened *before* you started `cilium monitor`.

**Comment by ldelossa** [comment]
@pchaigno that monitor output command was running before i invoked the connectivity tests. There are entries in there which include source ports before and after the failed requests.

**Comment by pchaigno** [comment]
Did the client pod exist before you invoked the connectivity tests? (That is, was it the first time you invoked the connectivity tests?) If it did exist, then the connection could predate the connectivity tests startup.

**Comment by ldelossa** [comment]
Good point, in order to reproduce easily the entire testing deployment remains in existence.

**Comment by pchaigno** [comment]
### Root Cause Analysis

From https://github.com/cilium/cilium-cli/issues/367#issuecomment-920218323, one hypothesis we had is the following sequence of events:
1. L7 policies are applied, causing redirections to the userspace proxy.
2. A UDP connection is established with source port X and the CT map tracks it.
3. L7 policies are removed, so redirections to the proxy shouldn't happen anymore.
4. A new UDP connection is established but it reuses source port X and therefore matches the existing CT entry. As a result, it is redirected to the userspace proxy, which drops the packet(s).

There is a timing constraints here: the new UDP connection should happen before GC has a chance to clean the old entry. GC runs every five minutes by default.

A collision on the source port also seems fairly unlikely, except if you take into account that Linux has a limited allocation range (~28k) and look at this as a sort of birthday paradox.

We should be able to confirm this using Hubble logs, to check that a previous UDP connection used the same port less than five minutes before. Unfortunately, Hubble didn't offer a way to differentiate between proxy redirects policy-verdicts and other policy-verdicts. We also didn't collect enough Hubble flows in our test. I fixed the first issue and opened a PR to increase the Hubble buffer size: https://github.com/cilium/cilium/pull/17429.

After a little while, the tests failed in that PR: https://github.com/cilium/cilium/pull/17429/checks?check_run_id=3640670462. At 14:43:05.952, we can see the usual `to-proxy` from client2 on port 46962 to CoreDNS. Checking the Hubble flows for that same nodes, we find the following:
```
$ cat hubble-confirm-cli-flake.json | ./hubble observe -t policy-verdict | grep 46962
Sep 18 14:39:46.618: cilium-test/client2-65f446d77c-7k5vl:46962 -> kube-system/coredns-d4866bcb7-42s9j:53 L3-L4 REDIRECTED (UDP)
```
So a first connection was established on that same 5-tuple, less than 5 minutes before, and redirected to the proxy. This seems to confirm the root cause is an incorrect redirect to the proxy from the stale UDP CT entry of a previous connection.

### Workaround

A first workaround would be to flush the CT table after applying new network security policies. A second option would be to decrease `conntrack-gc-interval` so that GC of stale CT entries happens more often. The second option is much less disruptive.

None of those options are viable for cilium-cli however since we need a solution that works for users, without requiring that they edit their configmap and without reestablishing all existing connections obviously :smile_cat: 

### Solution

Maybe a better solution here would be to have a grace period in the userspace proxy, before we actually start to drop packet for existing connections that shouldn't be redirected to the proxy anymore. I noticed that the TPROXY redirects were still in place in the datapath, so I'm assuming it's the proxy who drops packets here. /cc @jrajahalme

**Comment by ldelossa** [comment]
@pchaigno Do we actually see this issue in the wild ?

I'd like to consider whether this is just an issue during our tests or if we think users of Cilium will suffer from this. 

Do we believe users will be churning network policies as often as our automated test suite does? 

I ask because there are several trivial fixes we can implement today in our testing suite to solve this.

**Comment by pchaigno** [comment]
I doubt many users hit this in production, but we want the connectivity tests to work for users as well as our CI. As you've seen locally, anyone running the connectivity tests can hit this today, not only our CI.

**Comment by ldelossa** [comment]
> I doubt many users hit this in production, but we want the connectivity tests to work for users as well as our CI. As you've seen locally, anyone running the connectivity tests can hit this today, not only our CI.

Makes sense. 

> None of those options are viable for cilium-cli however since we need a solution that works for users, without requiring that they edit their configmap and without reestablishing all existing connections obviously 

We could experiment with increasing the source port range in our test runner - I am not sure right now if this is enforced by he host or if we can modify this via pod Spec. 

We could also test whether forcing non-l7 tests to always run before l7 tests fixes the issue. This however, may still demonstrate the issue just in the opposite direction.

**Comment by pchaigno** [comment]
I've performed evaluations of the different mitigations, by running the connectivity tests a hundred times:

| Mitigation | Rate of failures |
|--------------|----------------------|
| No mitigation | 49/100 |
| `conntrack-gc-interval=1m` (defaults to 5m) | 16/100 |
| `conntrack-gc-interval=30s`, `bpf-ct-timeout-regular-any=30s` (defaults to 1m) | 1/100 |
| Reordering tests | 0/100 |

Reordering tests corresponds to a patched CLI to guarantee tests will run in the order: no-policies, allow-all, client-ingress, echo-ingress, client-egress, to-entities-world, to-cidr-1111, echo-ingress-l7, client-egress-l7, dns-only, to-fqdns. The last three tests are the only with UDP redirects to the proxy. For that evaluation, I also flushed the CT between each full run of the connectivity tests instead of rebuilding the cluster.

I'll send a PR to reorder the tests as a temporary workaround.

**Comment by ldelossa** [comment]
@pchaigno - this is closed but I think we should track a "long term fix" ticket, what do you think?

**Comment by pchaigno** [comment]
The issue uncovered by these flaky tests is now tracked at https://github.com/cilium/cilium/issues/17459.
